{
  "registry_version": "contract-registry.v1",
  "contract_version": "v1.1",
  "status": "frozen",
  "source_document": "docs/design/【契约冻结】v1-表名-枚举-接口.md",
  "source_section": "附录 A 机器登记块",
  "generated_at": "2026-10-22",
  "canonical_profile": {
    "profile_id": "dih-canonical-json-v1",
    "encoding": "UTF-8",
    "json_rules": "RFC 8785",
    "digest_algorithm": "sha256",
    "digest_encoding": "lowercase-hex",
    "excluded_top_level_keys": [
      "generated_at",
      "artifact"
    ],
    "timestamp_format": "RFC3339-UTC-Z",
    "number_rules": "finite-only; integers exact; no negative zero",
    "unicode_rules": "preserve scalar values; no Unicode normalization",
    "null_policy": "required nulls are emitted; optional absent keys are omitted",
    "line_endings": "LF",
    "trailing_newline": "file-only; excluded from digest",
    "known_deviations": [
      "1e-07 formatting",
      "-0.0",
      "code-point key ordering"
    ],
    "forbidden_language": {
      "profile_id": "dih-descriptive-language-v1",
      "profile_version": "1.0.0",
      "source": "docs/superpowers/specs/2026-10-21-tikhub-governed-task-platform-design.md#5.7",
      "causal_terms_zh": [
        "导致",
        "驱动",
        "提升",
        "降低",
        "造成",
        "证明"
      ],
      "causal_terms_en": [
        "cause",
        "causes",
        "caused",
        "drive",
        "drives",
        "driven",
        "improve",
        "improves",
        "increase",
        "increases",
        "decrease",
        "decreases",
        "reduce",
        "reduces",
        "lead to",
        "leads to",
        "prove",
        "proves"
      ],
      "prediction_terms_zh": [
        "预测",
        "预计",
        "将会"
      ],
      "prediction_terms_en": [
        "predict",
        "predicts",
        "forecast",
        "forecasts",
        "projection",
        "projections"
      ],
      "prediction_objects_zh": [
        "销量",
        "市场份额",
        "转化率",
        "营收"
      ],
      "prediction_objects_en": [
        "sales",
        "market share",
        "conversion rate",
        "revenue"
      ],
      "allowed_relations_zh": [
        "共同出现",
        "相关",
        "描述性差异"
      ],
      "allowed_relations_en": [
        "co-occurrence",
        "correlation",
        "descriptive difference"
      ]
    },
    "pii_scan": {
      "profile_id": "export_policy.v1",
      "owner": "C11",
      "module": "apps/api/src/data_intelligence_hub/services/export_policy.py",
      "scanner": "scan_export_policy",
      "value_scanner": "scan_export_value",
      "finding_type": "PiiHit",
      "finding_codes": [
        "contact",
        "profile_link",
        "avatar",
        "tracking"
      ],
      "c9_error": "report_publish_gate_blocked",
      "c10_error": "delivery_pii_detected",
      "shared_by": [
        "C9",
        "C10"
      ],
      "no_second_ruleset": true
    }
  },
  "capability_profiles": [
    {
      "profile_id": "dih-template-capability-v1",
      "profile_version": "1.0.0",
      "registry_source": "apps/api/src/data_intelligence_hub/services/workbench_templates.py",
      "schema_path": "configs/contracts/v1.1.0/template_capability_profile.schema.json",
      "entrypoint": "template_capability_ids",
      "digest_function": "template_registry_digest",
      "digest_profile": "dih-canonical-json-v1",
      "digest_algorithm": "sha256",
      "digest_includes": [
        "template_id",
        "version",
        "markets",
        "package_tiers",
        "capability_allowlist",
        "thresholds"
      ],
      "empty_allowlist_policy": "deny_all",
      "unknown_template": "KeyError",
      "storage": "code_registry_not_table",
      "excluded_capability_ids": [
        "tikhub_tiktok_video_products",
        "tikhub_tiktok_creator_showcase"
      ]
    }
  ],
  "audit_actions": {
    "version": "audit-actions.v1",
    "actions": [
      {
        "name": "auth.login.succeeded",
        "owner": "C2",
        "status": "new",
        "phase": "C2"
      },
      {
        "name": "auth.login.failed",
        "owner": "C2",
        "status": "new",
        "phase": "C2"
      },
      {
        "name": "auth.logout.succeeded",
        "owner": "C2",
        "status": "new",
        "phase": "C2"
      },
      {
        "name": "workspace.member.added",
        "owner": "C2",
        "status": "new",
        "phase": "C2"
      },
      {
        "name": "workspace.member.role_changed",
        "owner": "C2",
        "status": "new",
        "phase": "C2"
      },
      {
        "name": "workspace.member.removed",
        "owner": "C2",
        "status": "new",
        "phase": "C2"
      },
      {
        "name": "project.created",
        "owner": "C2",
        "status": "new",
        "phase": "C2"
      },
      {
        "name": "project.updated",
        "owner": "C2",
        "status": "new",
        "phase": "C2"
      },
      {
        "name": "project.archived",
        "owner": "C2",
        "status": "new",
        "phase": "C2"
      },
      {
        "name": "project.member.added",
        "owner": "C2",
        "status": "new",
        "phase": "C2"
      },
      {
        "name": "project.member.removed",
        "owner": "C2",
        "status": "new",
        "phase": "C2"
      },
      {
        "name": "project.access.denied",
        "owner": "C2",
        "status": "new",
        "phase": "C2"
      },
      {
        "name": "project.management.denied",
        "owner": "C2",
        "status": "new",
        "phase": "C2"
      },
      {
        "name": "reviewer.access.granted",
        "owner": "C2",
        "status": "new",
        "phase": "C2"
      },
      {
        "name": "reviewer.access.denied",
        "owner": "C2",
        "status": "new",
        "phase": "C2"
      },
      {
        "name": "config.switch.changed",
        "owner": "C2",
        "status": "new",
        "phase": "C2"
      },
      {
        "name": "project_api_key.issued",
        "owner": "C3",
        "status": "new",
        "phase": "C3"
      },
      {
        "name": "project_api_key.rotated",
        "owner": "C3",
        "status": "new",
        "phase": "C3"
      },
      {
        "name": "project_api_key.revoked",
        "owner": "C3",
        "status": "new",
        "phase": "C3"
      },
      {
        "name": "platform_credential.updated",
        "owner": "C3",
        "status": "new",
        "phase": "C3"
      },
      {
        "name": "platform_credential.removed",
        "owner": "C3",
        "status": "new",
        "phase": "C3"
      },
      {
        "name": "task.created",
        "owner": "C4",
        "status": "new",
        "phase": "C4"
      },
      {
        "name": "task.cancelled",
        "owner": "C4",
        "status": "new",
        "phase": "C4"
      },
      {
        "name": "budget.price.changed",
        "owner": "C5",
        "status": "new",
        "phase": "C5"
      },
      {
        "name": "budget.limit.changed",
        "owner": "C5",
        "status": "new",
        "phase": "C5"
      },
      {
        "name": "budget.blocked",
        "owner": "C5",
        "status": "new",
        "phase": "C5"
      },
      {
        "name": "budget.released",
        "owner": "C5",
        "status": "new",
        "phase": "C5"
      },
      {
        "name": "task.retried",
        "owner": "C6",
        "status": "new",
        "phase": "C6"
      },
      {
        "name": "run.created",
        "owner": "C4",
        "status": "new",
        "phase": "C4"
      },
      {
        "name": "run.cancel_requested",
        "owner": "C6",
        "status": "new",
        "phase": "C6"
      },
      {
        "name": "run.cancelled",
        "owner": "C6",
        "status": "new",
        "phase": "C6"
      },
      {
        "name": "run.retry_scheduled",
        "owner": "C6",
        "status": "new",
        "phase": "C6"
      },
      {
        "name": "run.retry_exhausted",
        "owner": "C6",
        "status": "new",
        "phase": "C6"
      },
      {
        "name": "run.completed",
        "owner": "C6",
        "status": "new",
        "phase": "C6"
      },
      {
        "name": "run.failed",
        "owner": "C6",
        "status": "new",
        "phase": "C6"
      },
      {
        "name": "claim.review.submitted",
        "owner": "C7",
        "status": "new",
        "phase": "C7"
      },
      {
        "name": "claim.review.approved",
        "owner": "C7",
        "status": "new",
        "phase": "C7"
      },
      {
        "name": "claim.review.rejected",
        "owner": "C7",
        "status": "new",
        "phase": "C7"
      },
      {
        "name": "claim.review.overridden",
        "owner": "C7",
        "status": "new",
        "phase": "C7"
      },
      {
        "name": "claim.blocked",
        "owner": "C7",
        "status": "new",
        "phase": "C7"
      },
      {
        "name": "claim.unblocked",
        "owner": "C7",
        "status": "new",
        "phase": "C7"
      },
      {
        "name": "claim.revised",
        "owner": "C7",
        "status": "new",
        "phase": "C7"
      },
      {
        "name": "dataset.quality.evaluated",
        "owner": "C8",
        "status": "new",
        "phase": "C8"
      },
      {
        "name": "quality.assessment.computed",
        "owner": "C8",
        "status": "new",
        "phase": "C8"
      },
      {
        "name": "quality.gap.resolved",
        "owner": "C8",
        "status": "new",
        "phase": "C8"
      },
      {
        "name": "quality.template.changed",
        "owner": "C8",
        "status": "new",
        "phase": "C8"
      },
      {
        "name": "report.review.approved",
        "owner": "C9",
        "status": "new",
        "phase": "C9"
      },
      {
        "name": "report.review.rejected",
        "owner": "C9",
        "status": "new",
        "phase": "C9"
      },